{
  "$schema": "https://agentworldprotocol.com/schemas/v0.1/telemetry-payload.schema.json",
  "window_ms": 5000,
  "observation_latency_ns": { "p50": 8200000, "p95": 21500000, "max": 40100000 },
  "admission_latency_ns": { "p50": 1100000, "p95": 3900000 },
  "channels": {
    "rgb_wrist": { "p50": 12400000, "p95": 27800000 },
    "proprio": { "p50": 900000, "p95": 2100000 }
  }
}
